ID,Codon_afectado,Tipo,Gen_ID,Efecto_Fenotipo
IZ467264,STE-XLA,sapien,94992528,"pede posuere nonummy integer non velit donec diam neque vestibulum"
IZ668168,PEA-HOX,montes,33177772,"massa tempor convallis nulla neque libero convallis eget eleifend"
JB470375,PMY-HKJ,"molestie lorem",93071622,"amet nunc viverra dapibus nulla"
JB563135,PEE-DMV,"duis at",76808563,"maecenas rhoncus aliquam lacus morbi quis"
JB895453,ZMU-XJR,"cras in",64240400,"ut nulla sed accumsan felis ut at dolor quis odio"
JB920295,XRO-EGU,"nam ultrices",3131187,"in faucibus orci luctus et ultrices posuere cubilia"
JC347286,VVY-IMA,nisi,35602784,"congue vivamus metus arcu adipiscing molestie hendrerit at vulputate"
JD390047,PYF-LHI,"posuere cubilia",54179636,"sit amet turpis elementum ligula vehicula consequat morbi"
JE889246,XBU-CPU,nibh,10726766,"amet consectetuer adipiscing elit proin interdum mauris non"
JE968026,QON-JQD,"pulvinar lobortis",53324483,"nascetur ridiculus"
JF474731,GCE-FXZ,ante,99343689,"lorem integer tincidunt ante vel ipsum praesent blandit"
JG044309,XVB-ZVL,"convallis duis",32530890,"elementum nullam varius nulla facilisi cras non velit"
JI493544,DAJ-KJH,"tempus semper",72189589,"pellentesque quisque porta volutpat erat"
JK119186,DFP-CGH,scelerisque,50413876,"odio justo sollicitudin"
JK853940,QVX-TRV,nulla,58267147,"phasellus sit amet erat nulla tempus"
JL010846,DNP-NDG,"sagittis nam",61610793,"nonummy integer non velit donec diam neque vestibulum"
JL126198,DPW-AQI,"elit sodales",67742363,"quis turpis eget elit sodales"
JL230968,XHH-PIP,eget,99629430,"eu mi nulla ac enim in"
JL350735,LUY-GQD,sapien,73596262,"luctus et ultrices posuere cubilia curae donec pharetra magna vestibulum"
JO021218,EEJ-LLG,"fusce lacus",46288372,"velit eu est congue elementum"
JO368381,SSF-IFX,proin,55084716,"nisl aenean"
JR110454,LFS-IBM,dui,75351036,"eget nunc donec"
JR844212,LCU-HZP,"in congue",9821351,"Severe intestinal pseudo-obstruction	"
JS453047,QLF-TLI,et,2272841,"curabitur gravida nisi at nibh in hac habitasse platea dictumst"
JT586124,KUI-MCX,"viverra diam",78072861,"nulla quisque arcu libero rutrum ac lobortis"
JT797184,TVL-PXW,"morbi vestibulum",87412372,"adipiscing molestie hendrerit at vulputate vitae"
JU514997,YSM-FDZ,"neque libero",67382238,"aliquet ultrices erat tortor sollicitudin mi sit amet lobortis"
JU600606,ALA-DSX,venenatis,10701456,"morbi ut odio cras mi pede malesuada in imperdiet et"
JU921760,FPB-KHM,rutrum,65533993,"nonummy integer non velit donec diam"
JU993154,HUR-GPV,"volutpat sapien",97195770,"sollicitudin ut suscipit a feugiat et eros vestibulum ac est"
JV415376,PHV-GJQ,libero,48856442,"pellentesque at nulla suspendisse potenti cras in"
JW866846,NVO-KXG,eros,64362858,"morbi vel lectus in quam fringilla rhoncus"
JX154401,DXY-DFC,ipsum,59479845,"vitae consectetuer eget rutrum at lorem integer"
JX621187,CZS-RRJ,lacinia,23550878,"suscipit ligula in lacus curabitur"
JY131459,GPF-FJV,ante,2003183,"massa id"
JY288198,VRE-HTG,tortor,45091861,"et commodo vulputate justo"
JY606136,XLU-ROZ,"maecenas ut",95492551,"et ultrices posuere cubilia curae donec pharetra magna"
JY945836,XNB-PIW,proin,83839772,"bibendum imperdiet nullam"
JZ652196,AMI-SJT,"vestibulum eget",84798931,"nibh in quis justo maecenas rhoncus aliquam lacus morbi"
JZ793165,PFL-HOE,"neque libero",21268945,"a pede posuere nonummy integer non"
KA162352,YEM-EQK,"vestibulum vestibulum",62506033,"est phasellus"
KA412192,MLD-AUH,"dapibus augue",13444238,"luctus et ultrices"
KA562363,KAX-GUI,erat,70991193,"dapibus at diam nam tristique tortor eu"
KB610966,LDR-ZCI,"diam id",29733985,"fusce congue diam id ornare imperdiet sapien urna pretium"
KB843447,ZGN-LKA,nulla,89753960,"ultrices posuere cubilia curae duis faucibus accumsan odio curabitur"
KC418755,LKL-VKV,"aliquet maecenas",14595532,"dui proin leo odio porttitor"
KC469973,PBC-ELV,sollicitudin,44679314,"mattis odio donec vitae"
KD770916,STP-FIO,"orci nullam",95613039,"eget rutrum at lorem integer tincidunt ante"
KD825048,UKX-BRD,"id ornare",94734603,"pede posuere nonummy integer non velit donec diam neque"
KH766755,ANS-PTZ,augue,90125948,"lectus suspendisse potenti in eleifend quam a odio"
KI719932,RLQ-GGU,eget,77911467,"venenatis tristique fusce congue diam id ornare"
KJ417466,HRN-MGR,in,71237497,"justo morbi ut odio cras mi"
KJ760187,FRW-NDM,auctor,54187241,"est phasellus sit amet erat nulla tempus vivamus in"
KK323090,IPA-SRU,sit,44511053,"vulputate luctus cum sociis natoque penatibus et magnis dis"
KK459324,JEK-ERV,et,44168790,"sapien iaculis congue vivamus metus arcu adipiscing molestie hendrerit at"
KK521228,IRP-OQJ,vitae,35782302,"donec ut dolor morbi"
KL755949,BRN-HQU,"potenti nullam",3721025,"enim blandit"
KL924337,LSO-RHR,"luctus rutrum",25966406,"diam cras pellentesque volutpat dui maecenas"
KN208729,JKX-YCG,lacus,37172814,"ut at dolor quis odio consequat varius"
KN431009,APD-BSS,"vehicula consequat",39728536,"accumsan tortor quis turpis sed ante vivamus"
KO447374,DNB-KXP,"ut tellus",27551291,"risus auctor"
KO724934,XQA-YSN,"suspendisse accumsan",6573535,"interdum eu tincidunt in leo maecenas pulvinar lobortis"
KR436980,DED-PEG,"quis orci",33970183,"lectus pellentesque eget nunc donec quis"
KS137193,JIM-FKF,"nullam orci",56190771,"vestibulum ante ipsum primis in faucibus orci"
KS176011,NOB-KVU,"porta volutpat",76524937,"ac est lacinia nisi venenatis tristique fusce"
KS648686,YOT-PDO,"morbi non",24817601,"maecenas rhoncus aliquam lacus morbi quis tortor"
KT050098,FUV-ZBJ,"erat eros",46711212,"sed tristique in"
KT407566,KLO-UQS,"nulla justo",79655126,"fermentum donec ut"
KT972581,LLW-WAS,"sociis natoque",27880453,"nisi nam ultrices libero non mattis pulvinar nulla pede"
KU920056,VVX-GYC,massa,99556218,"ac neque duis"
KW823569,AYE-DFW,vulputate,81255406,"lacus at turpis donec posuere metus vitae ipsum aliquam"
KW989661,CXW-CKG,lectus,7351282,"feugiat non pretium quis lectus suspendisse potenti"
KX467607,MOF-TRJ,"nulla justo",92187564,"sociis natoque penatibus et magnis"
KY849509,VST-NWP,"faucibus accumsan",26252194,"sem fusce consequat nulla nisl nunc nisl duis"
LA614605,ILX-NCU,donec,23170950,"justo maecenas rhoncus"
LB283057,CPB-POT,blandit,94618495,"interdum in ante vestibulum ante"
LB765165,XOE-MVC,"sodales scelerisque",41932410,"platea dictumst maecenas ut massa quis augue"
LC358034,HFR-EPX,sociis,13147375,"suspendisse accumsan tortor"
LD261483,YLF-HUO,sodales,2305732,"dui luctus rutrum nulla tellus in sagittis dui vel"
LE792542,DWZ-SAA,"in purus",53278665,"aliquam lacus morbi quis tortor id nulla ultrices aliquet"
LF515087,LTW-YRD,quisque,19642944,"curae duis faucibus accumsan"
LF567020,KXW-QRD,"laoreet ut",95996022,"in blandit"
LH900126,SID-VGA,sit,65917683,"amet turpis elementum ligula vehicula"
LI493344,YXA-MUJ,iaculis,35085721,"nam ultrices libero"
LI535433,NSH-WTP,"rutrum nulla",94311118,"mauris laoreet ut rhoncus aliquet"
LI656530,IOF-RME,"quisque arcu",60483587,"pede ac diam cras pellentesque volutpat dui maecenas"
LK527609,BJR-WDU,"leo odio",46514788,"dapibus nulla suscipit"
LK702771,SYA-QNN,mauris,76014959,"ultrices phasellus id sapien in sapien iaculis"
LL078433,SYM-FAY,maecenas,34710186,"augue quam sollicitudin vitae consectetuer eget rutrum"
LL134558,ZNH-SSA,"etiam faucibus",51768873,"pharetra magna ac consequat metus sapien ut"
LM663683,OLD-BWB,"nunc proin",70290482,"gravida sem"
LO910849,NXW-KTW,malesuada,24620645,"primis in faucibus"
LP273420,HQA-XXD,"diam cras",96750980,"molestie sed justo pellentesque viverra pede ac diam"
LP656907,TJC-NAI,"semper rutrum",86960312,"quis libero nullam sit"
LP786005,WOL-MHA,vivamus,59864370,"suspendisse potenti"
LQ077324,LOQ-QEZ,vestibulum,25401752,"imperdiet sapien urna pretium nisl ut volutpat sapien arcu"
LR518143,TBQ-BOT,"sapien quis",44477008,"vestibulum sagittis sapien cum sociis natoque penatibus et"
LR632438,UAS-CCV,sed,75632434,"id ligula suspendisse ornare consequat lectus"
LS325928,LIK-BYT,morbi,51531823,"eget nunc donec quis orci eget orci vehicula condimentum curabitur"
LT218027,HVC-CUK,tortor,6493751,"velit vivamus vel"
LT266097,QBI-NGX,"ante ipsum",18060632,"suspendisse potenti cras in purus eu magna vulputate"
LT308091,DNI-HLQ,phasellus,91837175,"a pede posuere nonummy integer non velit"
LT660345,PWA-AZW,"quis orci",95117613,"justo eu massa donec dapibus"
LT699958,HMP-ZNC,"platea dictumst",69243656,"vel pede morbi"
LU546957,CGL-KYC,eget,71676219,"quis orci eget orci vehicula condimentum"
LU669930,ZFC-TFX,gravida,67310758,"amet lobortis"
LW334314,DFX-WVM,"suscipit ligula",57944309,"natoque penatibus et magnis dis parturient"
LW650727,JCN-WHS,nibh,76971687,"justo sollicitudin ut suscipit"
LX259304,JQV-SLO,"in tempus",78180309,"erat id mauris"
LX293668,KZS-DWH,"vitae ipsum",99194264,"mauris morbi non lectus aliquam sit amet diam"
LZ259266,IDS-UWM,sapien,79592479,"ultrices erat tortor sollicitudin mi sit amet"
LZ497111,PGU-BCM,"nibh fusce",76753062,"erat curabitur gravida"
MA189545,QXF-BHX,"nulla sed",87172832,"ipsum primis in faucibus orci luctus"
MA665333,RET-VZP,"etiam justo",67758018,"ac lobortis vel dapibus at diam nam tristique"
MA733376,IVG-BQX,sagittis,46840346,"dapibus augue vel accumsan tellus"
MC035753,MCF-JJI,libero,56240787,"volutpat quam"
MC433906,CNX-ZSU,"libero ut",69140803,"justo aliquam quis turpis eget elit sodales scelerisque mauris sit"
ME290291,TPY-QPE,"morbi a",52073157,"parturient montes nascetur ridiculus mus etiam vel augue vestibulum"
MF437588,JEQ-IUO,"duis ac",75764388,"morbi vestibulum velit"
MG533817,EJE-THV,"morbi vestibulum",12019597,"dui proin leo odio"
MI399639,TDU-FQJ,a,62791194,"rutrum rutrum neque"
MK327636,QMY-UMF,donec,43167811,"nulla nunc purus phasellus in"
MK735964,LGK-XVD,"vel enim",18723042,"justo morbi ut odio"
ML466235,XGO-ZAR,"volutpat dui",83395155,"ultrices enim lorem ipsum dolor sit amet"
MM278355,KBG-EBW,"vitae nisl",98316619,"est lacinia"
MM857628,EUQ-IIM,ac,93459247,"imperdiet sapien"
MN070253,QIS-HHB,"morbi sem",22296409,"cursus vestibulum proin"
MN376927,BJX-HLG,"interdum venenatis",27363551,"nulla ac enim in tempor turpis nec euismod scelerisque quam"
MO013093,MOT-ITK,"montes nascetur",41586437,"ultrices libero non mattis"
MO906841,JSJ-BKZ,eget,99750172,"eleifend pede libero quis orci"
MP104880,ROG-FBT,"ut erat",44448613,"mauris morbi non lectus aliquam sit"
MP562564,TTK-BFD,"dictumst morbi",80852129,"pede venenatis non sodales sed"
MQ674242,ZHL-ONK,"aliquet maecenas",3226173,"lobortis est phasellus sit amet erat"
MQ772410,ZMW-GSG,"semper rutrum",42957440,"id lobortis convallis tortor risus"
MR184268,APO-NQG,"integer aliquet",14663021,"sem duis aliquam convallis"
MR285395,UYU-MRB,"nulla facilisi",94424425,"odio in hac habitasse"
MR298443,NKI-OOU,condimentum,17604317,"eros viverra eget congue"
MS152780,PXD-JDQ,non,30882190,"rutrum ac lobortis"
MS819164,FEU-SRO,morbi,51612473,"lacus morbi sem mauris laoreet ut rhoncus aliquet pulvinar"
MT668142,IBG-ZRG,"nulla sed",14491719,"nulla ac enim in tempor"
MU571127,LDY-APZ,aliquam,44230414,"nunc vestibulum ante"
MU805481,VGJ-JMK,"pede ullamcorper",78796403,"morbi odio odio elementum"
MV484396,JHT-SFI,"pretium iaculis",77439274,"dolor sit amet consectetuer"
MV610247,RZK-UIU,"lectus pellentesque",49334474,"sem praesent id massa id nisl venenatis lacinia aenean sit"
MV881302,IEP-NVQ,dapibus,58798407,"mus etiam vel augue vestibulum rutrum rutrum neque"
MW241439,MOG-CDB,"nam congue",71071337,"sapien in sapien iaculis congue vivamus metus arcu"
MW544310,TVE-CKH,sed,12682577,"semper est quam"
MW835023,EUR-XLU,"potenti in",61404238,"libero nam dui proin leo"
MY641488,WBT-JSA,quis,50600264,"erat id mauris vulputate elementum nullam varius nulla facilisi cras"
MY904214,CEV-JKO,nec,35500868,"odio consequat varius integer ac leo pellentesque ultrices mattis odio"
NA840786,CSU-HND,neque,64511452,"sed justo pellentesque viverra pede ac diam"
NB026517,GBA-GMH,phasellus,85024055,"Menkes syndrome"
NC089661,IFQ-IQG,a,30174248,"nibh fusce"
NC134648,JPQ-VVJ,ac,54960956,"rhoncus aliquet pulvinar sed"
NE718338,QIH-OHU,nisi,46484369,"at ipsum ac tellus semper interdum mauris ullamcorper purus"
NG624941,CLU-XHO,"vestibulum sed",48693868,"GABA-transaminase deficiency"
NH264422,JYZ-DBK,"sodales sed",43947601,"libero rutrum"
NH451616,CFM-EGP,"tellus nisi",48522313,"consectetuer adipiscing elit proin risus praesent"
NH669814,NFW-NHJ,ut,59391730,"ac est lacinia nisi"
NH956331,MYH-VTN,faucibus,96464032,"sed tincidunt eu felis"
NI282984,CFS-ETD,etiam,27778645,"sed tristique in tempus sit amet sem fusce"
NI346464,HIZ-ALI,eleifend,72733764,"risus auctor sed tristique in tempus sit"
NJ571871,RKB-ELR,"orci luctus",17898204,"sollicitudin vitae consectetuer"
NJ896966,ESD-WFH,"non sodales",64523973,"integer ac leo pellentesque ultrices mattis odio"
NK037951,KPO-EET,"luctus et",60504618,"sit amet sapien dignissim vestibulum vestibulum"
NL123977,VCK-SUY,"vivamus in",76300109,"hac habitasse platea dictumst morbi"
NM159731,EKS-XWF,montes,66024646,"duis faucibus accumsan odio curabitur convallis duis"
NM792275,ANS-APZ,"cum sociis",44754658,"id massa id nisl venenatis lacinia"
NN081223,PZY-XIC,"morbi non",50224017,"sed ante vivamus tortor duis mattis"
NN446699,NBO-KTG,"cum sociis",59854666,"convallis tortor risus dapibus"
NN917630,FVO-ZTN,"ut massa",549261,"amet sapien dignissim vestibulum vestibulum"
NO941054,CNY-JXI,"sapien iaculis",37115778,"nisi volutpat eleifend donec ut dolor morbi vel lectus"
NO997753,ZEF-JRY,"vulputate ut",80486323,"proin at turpis a pede posuere nonummy integer"
NP013019,RIJ-XOF,"consequat morbi",66906705,"sem fusce consequat nulla nisl nunc nisl"
NP680004,JUB-RXJ,augue,23487629,"montes nascetur ridiculus mus vivamus vestibulum"
NQ376510,XIX-EWN,"nisl duis",61142567,"nulla pede ullamcorper augue a suscipit nulla elit"
NQ786741,QQR-KMN,"sapien placerat",24483946,"nibh in quis justo maecenas"
NR561901,KMZ-NTJ,"vitae mattis",56214373,"cum sociis natoque penatibus"
NS721926,JLL-USV,fusce,60014960,"felis donec semper sapien a libero nam dui proin"
NT961048,MKB-HAE,"sed tristique",44400781,"turpis adipiscing lorem vitae mattis"
NU223906,TYX-WEK,"duis bibendum",12065155,"primis in faucibus orci"
NU294875,OYT-RGK,tempus,51113502,"viverra dapibus"
NV639563,NCT-ACZ,"ultrices posuere",25675609,"faucibus orci luctus et ultrices posuere"
NW964512,MZA-ITO,"nec molestie",57054437,"sapien in"
NX817561,PWC-DME,"sociis natoque",55744550,"imperdiet nullam orci pede venenatis non sodales sed tincidunt"
NX963052,KUP-VTY,"blandit mi",7813251,"turpis adipiscing lorem"
NY441110,FOO-XJQ,"lobortis vel",37705559,"nam dui proin leo odio porttitor id consequat"
NY904699,VIV-XXZ,sit,18893618,"at dolor quis odio consequat varius integer ac leo pellentesque"
NZ266529,XZJ-EJK,"aenean lectus",91044074,"sodales sed tincidunt eu felis fusce posuere felis"
OA726600,DNX-JMZ,id,68947902,"sem fusce consequat nulla nisl"
OB464787,AKU-RXH,"aliquam non",28056605,"cubilia curae nulla dapibus dolor vel est donec"
OC343177,MSA-BVY,"velit donec",25600876,"morbi porttitor lorem"
OC981509,QZJ-OXH,"fusce lacus",8010199,"velit donec diam neque vestibulum eget vulputate ut ultrices vel"
OD844246,AUI-IPR,sit,84515476,"libero non mattis pulvinar nulla pede ullamcorper augue a"
OE160548,BFD-ATL,"morbi odio",33505387,"nisl duis bibendum felis sed interdum venenatis"
OE682988,SOL-QKQ,"lacinia sapien",603136,"quam pharetra magna ac consequat metus sapien ut nunc"
OF365554,FNZ-FZI,vitae,17694425,"fusce posuere felis sed"
OF730258,JBL-VJH,odio,61261312,"eros suspendisse accumsan tortor"
OG054443,PAP-CTK,"massa tempor",27321489,"dis parturient montes"
OG950486,TDA-YKU,eget,9037276,"iaculis congue vivamus metus arcu adipiscing molestie hendrerit at vulputate"
OH277585,BXF-VRX,justo,44819995,"dolor sit amet consectetuer adipiscing elit proin"
OH280397,GPO-WHJ,suspendisse,45966093,"turpis elementum ligula vehicula consequat morbi a"
OH585270,BFE-TNH,ac,55949200,"morbi ut odio cras mi pede malesuada"
OJ886793,SCL-PPN,nec,26724789,"odio justo"
OL050518,ZMD-UIG,curae,65518956,"in hac habitasse platea dictumst etiam faucibus cursus urna ut"
OL154928,DZN-DXO,imperdiet,87067249,"ligula sit amet eleifend pede libero quis orci"
OL469014,UUQ-AJW,"at turpis",14704997,"dui vel"
OM051153,PSA-EOR,"erat id",65063997,"eleifend donec ut dolor morbi vel lectus"
ON415988,RZZ-RWD,gravida,42608688,"justo maecenas rhoncus aliquam lacus morbi"
ON456816,FVP-QLR,"tortor duis",98585191,"luctus tincidunt nulla mollis molestie lorem quisque"
OO273124,YEM-EMK,"habitasse platea",66129332,"aliquam non mauris morbi non"
OO666805,MOD-ZYX,"sollicitudin ut",50556400,"nulla neque libero convallis eget"
OP042456,SKS-YBI,"amet sem",40295755,"volutpat in congue etiam justo etiam pretium"
OQ524033,SUG-ESC,"ligula nec",25542469,"habitasse platea dictumst maecenas"
OQ606184,VKL-ZUP,libero,45724286,"rhoncus aliquam lacus morbi quis"
OS718964,OWE-KNT,"dapibus at",4592834,"et ultrices posuere"
OT772132,EUF-WVJ,"platea dictumst",16943130,"eu magna vulputate luctus cum sociis natoque"
OT815158,QIR-YDC,viverra,27488034,"odio odio elementum eu interdum eu tincidunt in leo"
OU111466,CCQ-FTT,"aliquam augue",38374405,"mattis odio donec"
OU341898,PDJ-DBR,"feugiat non",8870162,"neque duis"
OV274409,SQP-OLE,nec,59900489,"sed tristique"
OW243468,ART-UNR,quisque,88244404,"sapien non"
OW704688,SQT-LRX,"a feugiat",7313007,"enim leo rhoncus"
OX175342,UYN-IXI,"pede justo",10052751,"eget eleifend luctus ultricies eu nibh quisque id justo"
OY044578,HPW-QCA,"posuere cubilia",83672945,"integer ac neque duis bibendum morbi"
OY613033,USX-ZUI,interdum,57850566,"ac tellus semper interdum mauris ullamcorper purus sit amet nulla"
OY792200,XWP-YYD,porttitor,75874643,"vivamus vestibulum sagittis sapien cum"
OZ209803,XCQ-NKR,leo,43435104,"sapien cursus vestibulum proin eu mi nulla ac"
OZ641484,IPU-VSZ,"sem sed",26703842,"curabitur convallis duis consequat dui nec"
PB014948,HUE-NCB,"tincidunt eu",95039306,"sit amet cursus id"
PB125775,AOJ-IRR,pharetra,99985300,"duis ac nibh fusce lacus purus aliquet at feugiat"
PC908719,KGW-IID,"aliquet pulvinar",38730937,"etiam justo etiam"
PD263675,CLX-YIR,arcu,79120171,"consequat varius integer ac leo pellentesque ultrices mattis odio"
PD759260,WJD-OMH,quis,57029025,"diam cras pellentesque volutpat dui maecenas tristique est"
PF432014,TRC-IKT,imperdiet,11393371,"ut ultrices vel augue vestibulum ante ipsum"
PF527268,CUH-DBA,interdum,15424812,"nec condimentum neque"
PG286601,VBX-JMV,sociis,18356635,"lorem vitae mattis nibh ligula nec sem duis aliquam"
PG589333,QOI-VNC,"fermentum donec",64786065,"erat vestibulum sed magna"
PG746994,CCX-TON,"orci nullam",2995965,"tortor risus dapibus augue vel accumsan tellus nisi eu"
PG910919,ATZ-TCG,in,1905093,"massa quis augue luctus tincidunt nulla mollis molestie lorem quisque"
PH639243,NDY-NOJ,placerat,78665644,"aliquet maecenas"
PI113421,NCH-AYF,"in blandit",38930720,"dapibus dolor vel"
PI138334,HHM-FAD,purus,76314124,"ipsum integer a nibh in quis justo maecenas"
PK429506,LME-FMI,ac,57372336,"quam fringilla rhoncus mauris enim leo rhoncus sed"
PM934806,OAW-PXZ,"donec odio",79704152,"nullam varius nulla"
PN167303,KOG-GEB,"eget orci",11041122,"molestie hendrerit at vulputate vitae"
PN469671,SIH-XXW,"elit sodales",83816640,"magna ac consequat metus"
PN472384,DIJ-CVT,molestie,81929320,"enim leo rhoncus sed vestibulum"
PN779532,JAV-KQW,magnis,42081452,"in congue"
PN898235,QJU-OTG,sed,79176020,"pellentesque ultrices phasellus id sapien in"
PP350000,XZQ-SUS,aliquam,78530313,"dui proin leo odio porttitor id consequat in consequat"
PP541150,THT-GXC,"augue aliquam",10705397,"rhoncus aliquet pulvinar"
PQ806025,HQE-ZIA,nunc,55010149,"pulvinar nulla pede ullamcorper augue a suscipit nulla"
PQ851988,YOC-FEB,"magnis dis",4842321,"mus vivamus vestibulum sagittis sapien cum sociis"
PR973765,SPG-QZZ,mus,56612726,"id nulla ultrices"
PS544394,VVX-ZJE,"rutrum ac",48253125,"leo odio condimentum id luctus nec molestie sed justo"
PS728377,YPF-ERK,phasellus,98588861,"interdum mauris ullamcorper purus sit amet nulla quisque"
PS854494,FYF-SRH,morbi,46753340,"nec dui luctus rutrum nulla tellus"
PT938376,QKT-SZW,non,35260780,"posuere cubilia curae mauris viverra"
PU474792,AQL-YMF,"accumsan felis",44297129,"id nulla ultrices aliquet maecenas"
PV504468,QAW-JLM,"eget orci",47425390,"dapibus duis at velit eu est congue"
PW088708,XYV-OCH,"odio donec",22839338,"ipsum dolor sit amet consectetuer adipiscing"
PX081959,QID-OFQ,"semper interdum",45504259,"pulvinar lobortis est phasellus sit amet erat"
PX365750,XLX-SUY,donec,39003481,"massa id nisl venenatis lacinia aenean sit"
PY271460,MTQ-IGZ,"turpis eget",51654732,"nisi vulputate nonummy maecenas tincidunt lacus at velit"
QA201968,YYE-LIW,"rhoncus mauris",18525350,"imperdiet nullam orci pede venenatis"
QB730948,KFT-FEE,ultrices,16935618,"justo lacinia"
QB905286,MGH-ZCQ,"morbi porttitor",12914779,"dictumst aliquam augue quam sollicitudin vitae"
QC234685,QGH-VWU,cubilia,17145386,"tempor turpis nec euismod scelerisque quam turpis"
QC674664,GMT-PUT,vestibulum,32116144,"vulputate vitae nisl aenean lectus pellentesque eget nunc donec quis"
QC729746,WIF-EVW,enim,31925975,Neurodegeneration
QC799201,NJE-ZGM,aliquam,68349248,"nec euismod scelerisque quam"
QD153199,ASM-HYK,"vestibulum quam",8527840,"odio porttitor id consequat"
QD299322,EDF-UNR,est,75592836,"lacus purus aliquet at feugiat non"
QD693420,MIV-LPV,platea,48210221,"feugiat et eros vestibulum ac est lacinia"
QF078454,AAF-BWU,"aliquam non",2893873,"aliquet ultrices erat tortor sollicitudin mi sit"
QF206514,AFU-MNA,lorem,51370330,"ante ipsum primis in faucibus"
QF460235,TXF-BFQ,"hac habitasse",96871212,"ante ipsum primis in faucibus orci luctus et"
QF490501,FIX-KNM,porta,10608068,"volutpat convallis morbi odio odio elementum eu interdum eu"
QG576465,UIM-DNG,"eu interdum",80506076,"non ligula pellentesque ultrices phasellus"
QH200415,HSV-JBA,in,3858122,"tristique in"
QH909536,UJG-YKZ,eu,17389400,"convallis nulla neque"
QI289212,FEV-CRK,"ante nulla",78904109,"pretium iaculis diam erat fermentum"
QK013223,NKO-PQT,"erat id",79892231,"quam nec"
QL362216,ATS-KBV,eu,64963731,"sed vestibulum sit amet cursus id"
QL840757,HTC-BRR,praesent,83412549,"ipsum aliquam non mauris morbi non lectus aliquam"
QL940527,MCU-FOH,ac,86603354,"nulla nunc purus phasellus in felis donec semper sapien"
QM040537,VAS-WLQ,"eu est",81606337,"dolor vel est donec odio justo sollicitudin ut suscipit"
QM107041,KVP-IXK,augue,12750976,"pellentesque viverra pede ac diam cras pellentesque volutpat dui maecenas"
QM400639,UGW-NDS,"ut nunc",14647977,"nunc nisl duis bibendum felis sed"
QM454083,JLH-MMN,nunc,70056778,"sit amet consectetuer adipiscing elit proin risus"
QN282075,EFK-HLO,"luctus tincidunt",58476635,"sed nisl nunc rhoncus dui vel"
QN411630,JBF-QOS,"aenean lectus",5131424,"faucibus cursus urna ut tellus nulla"
QN909805,LKF-WFV,cursus,16095257,"amet sapien dignissim"
QP474009,IHC-SLV,proin,29971643,"venenatis non sodales sed tincidunt eu"
QP678888,OCK-PZL,"mauris vulputate",15243217,"praesent id massa id nisl venenatis"
QP728525,LCC-KAL,blandit,46826860,"nibh quisque id justo"
QR654617,VFU-MQJ,et,97997726,"erat nulla tempus vivamus in felis"
QR795089,EQB-IPP,vestibulum,39991908,"nec nisi vulputate nonummy maecenas tincidunt"
QR932565,RXD-XTW,vestibulum,86235978,"molestie nibh in lectus pellentesque"
QS209722,OAU-ZIP,sapien,87194328,"praesent blandit lacinia erat vestibulum sed magna"
QT022954,IMU-NQN,in,87672377,"interdum venenatis turpis enim blandit mi in porttitor"
QT264046,BNB-WKQ,"nam nulla",43158617,"donec odio justo sollicitudin ut suscipit a feugiat"
QT531893,AFO-ZDR,molestie,89238319,"hendrerit at vulputate vitae nisl aenean lectus pellentesque eget"
QU769527,AKR-PLA,vehicula,21781476,"in imperdiet et commodo vulputate justo in blandit"
QV221856,HPG-FAV,non,601925,"aliquet maecenas leo odio condimentum id luctus"
QX017609,WCF-VOO,eget,17975480,"erat nulla tempus vivamus in felis eu sapien cursus vestibulum"
QX276929,QTJ-JHN,eu,51363963,"tortor id nulla ultrices"
QY442713,XES-EMR,"eu interdum",96507519,"tellus in sagittis dui vel"
QZ029383,SXB-GPG,"praesent id",99420748,"est lacinia nisi venenatis tristique fusce congue diam id ornare"
RA132188,EVU-KBO,"venenatis non",26373629,"id ornare imperdiet sapien urna pretium nisl"
RA189217,RBI-IHL,at,38590646,"sed ante vivamus"
RA702397,RII-HEP,tempor,37781895,"bibendum felis sed interdum venenatis turpis enim blandit"
RB284146,MIL-DVK,duis,76352316,"aliquam augue quam sollicitudin vitae consectetuer eget rutrum at"
RC231752,OCH-JQJ,amet,57762202,"morbi a"
RD163097,ZZH-MWZ,"ut at",1966184,"ac neque duis bibendum morbi"
RD757963,ZUX-SNX,"risus semper",42222050,"sit amet nulla quisque"
RD978959,REV-JJU,convallis,8412814,"nisi eu orci mauris lacinia sapien quis libero nullam"
RE526407,QYB-KBE,"donec vitae",11371258,"mattis egestas metus aenean fermentum"
RF287486,TDO-MAD,"pede posuere",34635716,"felis fusce"
RF500849,TJI-OYO,"aliquam quis",93948307,"justo etiam pretium iaculis"
RG489265,QPX-GEB,et,7983394,"Megacystis-microcolon-intestinal hypoperistalsis syndrome"
RG981906,SYH-GOS,"placerat praesent",87424270,"maecenas rhoncus aliquam lacus morbi quis tortor id"
RH453681,PCW-XGX,"amet lobortis",58692735,"orci vehicula condimentum curabitur in libero ut massa"
RH799881,DZW-ZFT,odio,8713381,"id mauris"
RH892563,SZR-WUF,congue,53601876,"pulvinar sed nisl nunc rhoncus dui vel sem sed sagittis"
RI187002,WSH-ZKN,"nec nisi",7312714,"pede morbi porttitor lorem id ligula suspendisse ornare consequat lectus"
RI789322,IPO-QYO,luctus,60682898,"proin risus praesent lectus vestibulum"
RJ078583,BNL-EHO,"sapien cum",37714292,"orci eget orci vehicula"
RJ182416,JVD-XSI,interdum,91627104,"nulla facilisi"
RK120500,TLM-KZJ,"ultrices libero",55459908,"quis lectus suspendisse potenti in eleifend"
RK135058,XCP-VFU,"amet cursus",18673647,"id ligula suspendisse ornare consequat lectus in est"
RM573577,DHV-UWL,"dapibus augue",33750924,"velit eu est"
RM695360,FAF-VNH,"vulputate elementum",25060420,"ut erat curabitur gravida nisi"
