ID,Codon_afectado,Tipo,Gen_ID,Efecto_Fenotipo
RM829763,KDY-VUA,"sed vestibulum",49327666,"lacinia sapien quis libero nullam sit amet"
RN156082,PWO-ZVZ,duis,24503265,"accumsan odio curabitur convallis duis consequat dui nec nisi"
RN624030,QUD-UKO,semper,86694988,"integer a"
RP058686,HNP-WHE,"orci luctus",9959452,"etiam pretium iaculis justo in hac habitasse platea dictumst etiam"
RQ022282,UIE-GYZ,vel,18476681,"quam suspendisse potenti nullam porttitor lacus at turpis donec posuere"
RR270832,SKF-HYT,"nisl nunc",13891709,"commodo placerat praesent blandit nam nulla integer pede"
RR282071,UHF-ZDT,sed,18267181,"sed ante"
RS949178,TJE-TLQ,"fusce lacus",4932451,"faucibus cursus urna ut tellus nulla ut"
RT100591,FPA-HHB,"sit amet",87700844,"convallis nunc proin"
RT426307,IXE-MBI,"nibh in",85667720,"interdum eu tincidunt in leo maecenas pulvinar lobortis est phasellus"
RV499572,UCF-HZG,"justo in",66490468,"vestibulum rutrum rutrum neque aenean auctor gravida sem praesent"
RV508915,ZOQ-ZZN,libero,64731189,"posuere metus vitae ipsum"
RV609025,XCI-GVB,"non mauris",14713171,"eget nunc donec quis orci eget orci vehicula"
RW384042,JNU-PBH,"auctor gravida",48836335,"lacus morbi quis"
RW853236,CXA-ZOS,"duis mattis",88048931,"neque libero convallis eget eleifend luctus ultricies eu nibh"
RW989490,INQ-HKZ,"ut ultrices",81946020,"sapien varius ut blandit non"
RY062109,YZH-BLS,odio,60621565,"amet nunc viverra dapibus nulla suscipit ligula"
RY811812,YDY-FVM,"sit amet",84600729,"natoque penatibus et magnis dis"
RZ216100,CNK-XCX,in,16494610,"in libero ut massa volutpat convallis morbi odio odio elementum"
SA120766,QPO-XIL,"posuere metus",89619214,"placerat praesent blandit nam nulla integer pede justo"
SA554352,FHW-QQP,"sit amet",48648707,"volutpat in congue etiam justo etiam pretium iaculis justo in"
SA729899,ANX-QIA,"vel ipsum",1525469,"est donec odio"
SC713516,OTG-SCP,potenti,16309736,"ligula pellentesque ultrices phasellus id sapien"
SC738668,XEH-DFQ,et,21158378,"mus etiam vel augue vestibulum rutrum"
SD062387,AZF-RCQ,justo,15452926,"morbi vestibulum velit id pretium iaculis"
SF354606,ZUA-TLJ,ut,81675104,"vestibulum aliquet ultrices erat tortor sollicitudin mi"
SF423978,WOK-BBX,"ut at",33775542,"nisi at nibh"
SF490204,LSP-FGG,congue,68164061,"nullam molestie nibh"
SI791417,UXU-XIO,"elementum nullam",71803736,"quis justo maecenas"
SJ221827,WRX-XUK,"vitae quam",77153479,"aliquam sit amet diam in magna bibendum imperdiet nullam orci"
SJ731210,MNF-RAS,"et ultrices",69515286,"erat curabitur gravida nisi at"
SJ875277,XZG-BSA,"potenti cras",79622985,"nibh in"
SK224200,XTK-PWD,tempor,41443372,"neque sapien placerat ante nulla justo aliquam quis"
SK477841,TKS-CIA,"nulla pede",73244482,"sapien cum sociis"
SL724763,UGF-REX,"duis faucibus",7959027,"at feugiat non pretium quis lectus suspendisse"
SM001238,SFT-VZD,"orci pede",71441825,"sagittis dui vel nisl duis ac"
SN408801,AMJ-BOS,"volutpat in",83529814,"consequat metus sapien ut nunc"
SO050074,EQZ-HRI,"platea dictumst",13999271,"ornare consequat lectus in est"
SP028842,ADJ-UZN,"orci vehicula",50814704,"aliquam convallis nunc"
SP386908,NBV-VQV,metus,70709838,"quam pede lobortis ligula sit"
SP685442,MCY-WAU,"at feugiat",67479420,"ipsum primis in faucibus orci luctus et ultrices posuere"
SQ322095,LSQ-DZD,tellus,16188754,"pede venenatis non"
SR736771,GOV-SVP,phasellus,11906956,"morbi non quam nec dui luctus rutrum nulla tellus"
SR967386,USS-ULD,rhoncus,6754823,"nulla elit"
SS299556,JGW-EES,"in est",32768260,"vestibulum ac est lacinia nisi venenatis tristique fusce congue"
SS438239,TGF-JBV,ante,38821158,"maecenas tristique est et tempus semper est quam"
SS634676,NIG-RMN,odio,88620666,"enim lorem ipsum dolor"
SS658427,LJA-KEH,"etiam pretium",3900591,"diam id ornare imperdiet"
ST973338,YCM-FRQ,"eu nibh",8247170,"sapien cum sociis natoque"
ST980631,UIW-QCG,"ipsum dolor",84615506,"in imperdiet et commodo vulputate"
SU534413,FVG-NZJ,suspendisse,38619545,"convallis tortor risus dapibus augue vel accumsan tellus nisi eu"
SU975682,YOQ-EYD,"tristique fusce",14920117,"nec nisi volutpat eleifend donec ut"
SX413151,YDS-FWT,mauris,71464323,"diam in magna bibendum imperdiet nullam orci pede venenatis non"
SX516390,HVM-FLW,"molestie nibh",84180179,"interdum venenatis turpis"
SX639197,MMK-BAJ,"cras in",6317100,"sapien ut nunc vestibulum ante ipsum"
SX768422,EBK-UDU,"sed accumsan",98053476,"aliquam sit amet"
SY792609,NUT-WIP,"donec posuere",31112266,"felis eu sapien cursus vestibulum proin eu"
SY922065,KKB-WIU,"in faucibus",38369364,"vel est donec odio justo sollicitudin ut suscipit a"
SZ692668,ZBZ-KVJ,"congue eget",78559276,"fusce posuere"
SZ743454,HGU-PHP,cras,85541486,"nisi volutpat eleifend donec"
SZ854472,HOV-HVZ,"libero rutrum",37590057,"curabitur gravida nisi at nibh"
TA025668,VIE-DFB,libero,38305191,"nunc commodo"
TA043571,HAQ-WRW,mauris,31034614,"lorem integer tincidunt"
TA129552,BAG-QKZ,"pulvinar lobortis",4306090,"neque libero convallis eget"
TA362025,KEJ-UOA,curae,48378501,"vel nulla eget eros elementum pellentesque quisque porta volutpat erat"
TA861136,KHB-MEO,"justo pellentesque",17028118,"rutrum at lorem integer tincidunt ante vel ipsum praesent"
TC285760,PYB-MHG,est,91292861,"metus sapien ut nunc"
TD418704,KAX-YTV,"venenatis turpis",49580903,"aliquam erat volutpat in congue"
TD566394,THS-EPW,ut,90543912,"justo sollicitudin ut suscipit a"
TF887726,ANN-PVQ,lectus,72481260,"pede libero quis orci nullam molestie nibh"
TH187898,QXF-IIM,vestibulum,24760473,"est quam pharetra magna ac consequat metus sapien ut nunc"
TH757965,DGU-KES,"eu orci",90268457,"est lacinia nisi venenatis"
TI279288,ZFN-WUO,aliquet,29280242,"potenti in eleifend"
TJ068989,TCJ-IVB,nunc,73161029,"blandit lacinia"
TJ645239,DKT-UOV,ridiculus,46207465,"diam cras pellentesque"
TK792681,SMU-UUX,nam,55446306,"habitasse platea dictumst morbi"
TK977284,MRR-WPH,"ut at",60465634,"duis bibendum morbi non quam nec"
TM769205,BLO-QZG,"vel pede",64163301,"neque duis bibendum morbi non quam nec dui"
TM810744,OXZ-KWY,"nascetur ridiculus",66663171,"vulputate ut ultrices vel augue vestibulum ante"
TN144071,JGN-ZVP,"ultrices posuere",7110865,"dui vel sem sed sagittis nam congue risus"
TN235318,WMX-AZT,"parturient montes",32033675,"sit amet consectetuer"
TN639587,WXO-GKV,primis,59141633,"blandit lacinia erat vestibulum"
TN917549,FVC-HBP,"at ipsum",6981477,"augue vestibulum ante ipsum"
TO414936,EWX-SUJ,quisque,96868658,"velit vivamus vel nulla eget eros elementum pellentesque"
TO599323,KUW-YYK,"integer ac",27137546,"ut suscipit"
TO702141,PDA-PFP,vel,86945147,"duis bibendum morbi non quam nec dui luctus rutrum nulla"
TP180609,OWT-IPB,"quisque erat",46835136,"non quam nec"
TP833464,UCL-TKP,quis,63792204,"eget eros elementum"
TP914295,ZNQ-LXY,tincidunt,43001081,"non mauris morbi non lectus aliquam sit amet"
TQ857053,OAU-JNX,"nec sem",29499743,"lorem ipsum dolor sit amet consectetuer adipiscing elit proin interdum"
TR147828,AVW-AUN,ante,91289678,"erat tortor sollicitudin"
TR565754,DUO-RUY,dolor,7927174,"congue risus semper porta volutpat quam pede lobortis"
TS936374,PMB-XIB,"suscipit ligula",37414987,"tempus vivamus in felis eu sapien cursus"
TU006765,QKU-YNJ,"viverra pede",44642982,"elit ac nulla sed vel enim sit amet nunc"
TV715879,VIF-POC,hendrerit,45091856,"in faucibus"
TW843198,HGJ-KXI,"libero nam",92533031,"justo lacinia eget tincidunt eget tempus vel pede"
TX160354,VLK-ACG,lacus,48261226,"tellus nulla ut erat"
TX520259,OEK-VMX,eget,51538790,"accumsan odio curabitur convallis duis consequat dui"
TX762375,UXX-XUS,"praesent blandit",55300677,"vestibulum sit"
TY369059,WXY-TLM,"suscipit nulla",87770934,"non mauris morbi non lectus aliquam sit"
TY403815,KRP-XXH,platea,95697806,"posuere nonummy integer non velit donec diam neque vestibulum"
TZ851433,CJZ-NOM,"lorem vitae",99538907,"pulvinar sed nisl nunc rhoncus"
UA296404,FCF-NRH,at,7979162,"dapibus augue vel accumsan tellus nisi eu orci"
UB442037,XOJ-CJY,at,85296013,"donec ut"
UB755572,IUE-UYV,"pede posuere",89765866,"curabitur gravida nisi"
UC941194,UWZ-DSM,praesent,10599072,"duis bibendum morbi non quam nec dui"
UF024319,LGG-SXK,"sit amet",70961219,"interdum venenatis turpis enim"
UF153181,DZL-JYJ,vivamus,38766729,"quis libero nullam sit amet turpis elementum"
UG144476,MSR-WLG,"nisl aenean",66924742,"nulla mollis molestie lorem quisque ut"
UH567972,TRQ-POB,"in lacus",70837602,"quam sollicitudin vitae"
UH868844,SYC-VQE,sit,30890455,"justo morbi ut odio cras mi pede malesuada in imperdiet"
UJ652429,GAQ-IRI,"quam pharetra",34001870,"convallis duis consequat dui nec nisi volutpat eleifend donec ut"
UJ967175,CCW-JNA,vestibulum,63944909,"tristique est et"
UK282086,JTW-LQR,"pede malesuada",7283746,"augue aliquam erat volutpat in congue etiam"
UK499722,FUN-DLH,"vulputate elementum",23552345,"dapibus dolor vel est donec odio"
UL741713,PJR-NQK,"convallis morbi",45944353,"quis lectus suspendisse potenti in eleifend quam a"
UM713673,OSV-XZG,velit,97427488,"ornare consequat lectus in"
UQ354236,PIL-XZB,et,14009903,"ultrices erat tortor sollicitudin mi sit"
UQ828390,FYI-BLL,"luctus et",76265332,"nullam varius nulla facilisi cras non velit nec nisi"
US162314,AAD-WAI,"sit amet",14293052,"dictumst morbi vestibulum velit id pretium iaculis diam"
US589771,ENZ-HSO,"turpis a",48541903,"Microcephalic primordial dwarfism"
US690983,KVS-VXC,elit,16582911,"sociis natoque"
UU026423,LCE-HCA,"hac habitasse",82639019,"vivamus vestibulum sagittis sapien cum sociis"
UU065608,QPG-REM,mus,72141944,"faucibus cursus urna ut tellus nulla ut erat"
UU078474,DKM-RXS,est,57170412,"quis turpis eget elit sodales scelerisque mauris"
UV744372,NGU-BTB,"lectus in",50823954,"enim sit amet nunc viverra"
UW583633,QQB-JLY,"morbi porttitor",43405711,"cubilia curae duis faucibus accumsan odio curabitur convallis"
UX693695,RJB-HGA,"tempus semper",22617891,"vel est donec"
UX909014,OTV-KHF,"iaculis justo",96371268,"placerat praesent blandit nam nulla integer pede"
UZ363052,PDD-CGA,quam,18165379,"curae donec pharetra"
UZ669151,AXV-TOQ,ut,99659436,"augue vestibulum ante ipsum primis in faucibus"
UZ870627,JGG-ADY,"lobortis ligula",32531746,"dui maecenas tristique est et"
VA382453,RFD-VWJ,"vestibulum velit",53320020,"dictumst morbi vestibulum velit id pretium iaculis"
VB343252,SFW-FFQ,pede,59605406,"nulla sed accumsan felis ut at dolor quis odio"
VC316128,FVM-HTQ,quis,4686169,"phasellus in felis donec semper sapien a libero"
VC528357,PPY-WZJ,"non interdum",20005957,"parturient montes nascetur ridiculus mus etiam vel"
VC655297,SWG-NIN,ut,4800265,"enim leo rhoncus sed vestibulum sit amet cursus id"
VD561547,GKP-BHC,quis,19227111,"pellentesque at nulla suspendisse potenti cras in purus eu magna"
VH220009,ODV-DYQ,"maecenas ut",29767609,"volutpat erat quisque erat eros"
VI066998,VBI-ZYY,"rutrum nulla",41534086,"turpis integer aliquet massa id"
VI220005,CAE-BSL,posuere,78199727,"cubilia curae nulla dapibus dolor vel est donec odio"
VI385877,DMR-MYI,sed,68485356,"vel sem sed sagittis nam congue risus semper porta volutpat"
VI579362,FCI-YCV,elit,28723135,"nam nulla integer pede justo"
VI636203,AJB-LGA,cras,13685548,"id nulla ultrices aliquet maecenas leo odio condimentum id"
VJ845077,JLD-SFH,a,68069749,"massa donec dapibus duis at velit eu est congue"
VK121045,GKH-OFM,"odio curabitur",9370512,"ultrices aliquet maecenas leo odio condimentum"
VK596013,XWI-RSM,libero,79239722,"ipsum praesent"
VL011790,GQX-QMI,condimentum,35895286,"sed lacus morbi sem mauris laoreet ut rhoncus aliquet"
VL249191,OXX-PTF,mi,47235654,"eget semper rutrum nulla nunc purus"
VL648079,YMU-OAF,vestibulum,61616194,"vestibulum quam sapien varius ut blandit non interdum in"
VM199684,PEE-ONV,sem,14573631,"cum sociis natoque"
VM910343,DQA-XBK,ante,34855794,"non sodales sed tincidunt eu felis"
VN292806,JKX-FEH,morbi,86713799,"orci luctus et ultrices"
VN948965,TGG-FIL,rhoncus,43907886,"ridiculus mus"
VO935312,RIS-YBG,"non lectus",27215592,"a nibh in quis justo maecenas rhoncus aliquam lacus"
VQ281330,GOA-RPI,est,50392007,"condimentum neque sapien placerat"
VQ444494,CYT-ZWZ,luctus,40630857,"Severe intestinal pseudo-obstruction"
VQ858194,OJJ-PRW,purus,17676932,"tortor risus dapibus augue vel accumsan"
VR141125,UVZ-CHU,"urna pretium",58168848,"ut erat id"
VT655938,FKD-SQA,pellentesque,88114103,"consectetuer adipiscing elit proin interdum mauris"
VT779317,TMS-YVL,"nulla elit",88507060,"vestibulum rutrum rutrum neque aenean auctor gravida sem praesent id"
VU039974,ILE-ILX,"iaculis congue",62576431,"ultrices vel augue vestibulum ante ipsum primis in faucibus orci"
VV289407,OKE-OAU,"in ante",33305002,"cras pellentesque volutpat dui maecenas"
VW049960,GMS-WPE,"vulputate luctus",6033340,"nulla nisl nunc nisl duis"
VW532621,JVQ-QEA,"at velit",71723494,"lorem ipsum dolor sit amet consectetuer adipiscing elit"
VX373665,MFL-SDA,lacus,19983667,"ridiculus mus etiam vel"
VX406777,DSC-GHT,ante,53591392,"ligula suspendisse ornare consequat"
VY033814,TMZ-KHC,vel,96329431,"nec euismod"
VZ616937,ODH-LOB,aliquam,66138572,"tellus nulla ut"
VZ858724,DYW-PYL,diam,92835009,"tortor quis"
VZ893645,OJW-VLX,lacinia,77148317,"integer ac neque"
WA442311,KEQ-CBZ,"quam nec",73938637,"convallis nulla neque libero"
WA452969,RON-VCH,"rhoncus dui",58624170,"risus semper porta volutpat quam pede lobortis ligula"
WB155792,RMR-LFE,"at nulla",41553660,"posuere cubilia curae donec pharetra magna vestibulum aliquet ultrices"
WB212678,XKA-FSK,"suscipit ligula",35678616,"placerat praesent blandit nam nulla"
WB216793,ULE-IBT,"metus sapien",20287454,"pede justo lacinia eget tincidunt"
WB715846,JLW-IWD,"curabitur at",50356734,"in lectus"
WB754713,OFJ-JGL,"integer non",85939716,"est congue elementum"
WD387631,NIN-VCC,"quis justo",60802557,"vel accumsan tellus nisi eu orci mauris lacinia sapien"
WD536355,CEA-BPC,"libero rutrum",185047,"pede morbi porttitor lorem"
WD855686,BWX-TUE,vel,92100991,"ligula pellentesque ultrices phasellus id sapien in sapien iaculis congue"
WE238573,ZKJ-BXV,elit,48787136,"donec vitae nisi nam ultrices libero non"
WE649086,KJF-BAC,posuere,102545,"hac habitasse platea dictumst aliquam augue"
WF639761,PDD-LIN,dictumst,36621494,"turpis eget elit sodales scelerisque mauris sit amet eros"
WF692920,NGS-FND,ligula,23276329,"consequat morbi a ipsum integer a nibh in quis justo"
WG300548,SQO-HHH,morbi,99555790,"nibh in lectus pellentesque at nulla suspendisse potenti"
WH504867,DGV-BUK,nisl,59397981,"orci luctus et ultrices posuere cubilia curae"
WH810063,YSA-MXB,"turpis eget",63685925,"lacinia erat vestibulum sed magna at nunc commodo placerat"
WI995718,KQJ-DET,"metus sapien",5327425,"nonummy maecenas tincidunt lacus at velit vivamus vel"
WJ131446,SVN-DGI,posuere,84945362,"mauris morbi non lectus aliquam sit amet"
WJ218817,SVD-BEB,eu,73279369,"faucibus orci luctus et ultrices posuere cubilia curae mauris"
WJ843778,VHH-TQU,"orci luctus",98504209,"penatibus et"
WK336802,VBG-EDW,et,98517499,"mauris vulputate"
WL782617,ZBY-JET,"rhoncus mauris",58949669,"Chronic intestinal pseudo-obstruction"
WM847012,LEM-QTN,nunc,96161126,"nibh in quis justo maecenas rhoncus aliquam lacus morbi quis"
WN313063,NIL-YPI,"aenean lectus",27055557,"semper porta volutpat quam pede lobortis ligula sit amet eleifend"
WP047516,VRW-BEB,"adipiscing molestie",10833958,"in libero ut massa volutpat convallis morbi odio"
WP099553,FIA-TKY,"donec posuere",94397508,"id mauris vulputate elementum nullam varius"
WQ221465,DZY-WPT,habitasse,6297695,"egestas metus aenean fermentum donec ut mauris eget"
WQ896264,BNE-GHB,"nulla eget",57472504,"nibh in lectus"
WR222540,IVT-AYK,"tincidunt eu",55520518,"a nibh in quis justo"
WS452600,QEJ-LRH,"vivamus tortor",87581095,"non pretium quis lectus suspendisse"
WS510383,JVA-TDB,molestie,32853454,"magnis dis parturient"
WS917363,NXC-BLH,id,35920986,"eu sapien cursus vestibulum proin"
WS956629,RAW-WMQ,"ut suscipit",92947847,"Meier-Gorlin syndrome"
WT626902,PHC-KQL,consequat,65716179,"duis consequat dui nec nisi"
WV225783,JHJ-PYC,vestibulum,11063679,"ut blandit non interdum in ante"
WV846473,UYW-PLO,nullam,7139249,"justo sollicitudin ut suscipit a feugiat et eros vestibulum"
WW814253,SPT-SVE,nec,29032359,"malesuada in imperdiet et commodo vulputate"
WW818098,MTM-AUM,"velit nec",79157100,"nec nisi vulputate nonummy maecenas tincidunt lacus at velit"
WX286604,JIW-HKB,"massa id",48741655,"id sapien in sapien iaculis congue"
WX340621,DVS-ELG,"nunc donec",41087827,"dolor sit amet consectetuer adipiscing elit"
WY786600,UFW-GQG,"integer non",38977976,"magnis dis parturient montes nascetur ridiculus"
WY895636,XPI-GET,rutrum,59474437,"sem fusce"
WZ704192,YKV-KBU,"hendrerit at",8249102,"nulla pede ullamcorper augue a suscipit nulla elit ac nulla"
WZ897237,ZBV-BMI,vel,93345052,"est quam"
XB040054,ZRZ-INE,"vulputate nonummy",77207668,"ut erat id mauris vulputate elementum nullam"
XB836373,VEA-WNQ,et,79643571,"turpis eget elit sodales"
XC682670,RUY-TMX,primis,52580986,"velit vivamus vel nulla eget"
XD346656,OJS-MKS,morbi,92919506,"ut mauris eget massa tempor convallis nulla"
XE532827,XDB-OZX,in,93998501,"viverra eget congue eget semper rutrum nulla nunc purus phasellus"
XG097064,FVF-UEQ,phasellus,76471948,"nulla tempus vivamus in felis eu sapien cursus vestibulum"
XG105292,ESD-SNH,sed,38472030,"luctus et ultrices posuere cubilia curae mauris"
XG292614,UJL-LIT,"mauris vulputate",71100977,"orci luctus et ultrices posuere"
XG329116,FQI-VLA,ornare,52503791,"blandit non interdum in ante vestibulum ante ipsum"
XI824537,OGU-LXL,"luctus et",42716744,"aliquam convallis nunc proin at turpis a pede posuere nonummy"
XJ854596,UUY-DRL,"tincidunt in",80193863,"curabitur in libero ut massa volutpat convallis"
XK537753,GVS-MKV,"curabitur gravida",97216388,"consequat dui nec nisi volutpat eleifend donec ut dolor"
XL007827,YQS-RNK,magna,27423379,"porttitor lorem"
XM956297,GNT-XQG,"ligula vehicula",43073078,"rutrum ac lobortis vel dapibus"
XN014683,MVK-DMI,"dignissim vestibulum",70314560,"maecenas ut massa quis augue luctus tincidunt nulla"
XN905133,BTC-OES,"orci eget",24072137,"consequat ut nulla sed accumsan felis ut"
XO408094,VTO-FCZ,"nec nisi",750575,"ligula in lacus"
XO720859,DAF-DMH,"odio donec",75085748,"et ultrices posuere cubilia curae mauris viverra"
XR503681,BQV-SOL,"id luctus",66727935,"eu tincidunt in leo maecenas"
XV011685,EZP-LOU,"in quam",48763055,"duis consequat dui nec nisi volutpat eleifend"
XV396303,REW-AQH,"risus praesent",12958148,"donec pharetra magna vestibulum aliquet ultrices"
XW690531,OKB-FCP,quis,54756083,"libero non mattis pulvinar nulla pede ullamcorper"
XX967929,CLG-LVU,ultrices,56873153,"ac nibh fusce lacus purus"
YA748548,NEJ-NPU,"nulla tempus",18827223,"tortor sollicitudin mi sit amet"
YB427083,AKR-TZL,sapien,57628913,"mauris vulputate elementum nullam varius nulla facilisi cras non"
YB853734,PJX-XMH,"maecenas pulvinar",51227681,"congue etiam justo etiam pretium iaculis justo in hac habitasse"
YD814251,GBU-RGF,"auctor sed",18261609,"potenti nullam"
YD832219,QQM-QSZ,"lectus aliquam",46007535,"neque sapien placerat ante nulla"
YG392654,KKQ-RYX,consequat,86042401,"ullamcorper augue a suscipit nulla elit"
YI381598,XVW-QJX,"suscipit nulla",47510496,"nisl duis bibendum"
YL610576,GVS-OEJ,"vivamus tortor",11132682,"quam a odio in hac habitasse platea"
YM098461,KDY-IXP,"metus aenean",65034374,"libero convallis eget eleifend luctus ultricies eu nibh"
YM466039,DRC-WOW,"leo rhoncus",72488974,"est risus auctor sed tristique in tempus sit amet"
YM743078,CEI-WTG,"morbi vestibulum",79945637,"erat id mauris vulputate"
YO887430,KNI-BCK,dictumst,5582078,"sapien varius ut blandit"
YP274740,HFW-XQN,aenean,37322070,"dui luctus rutrum nulla"
YS141961,TAN-ERF,"venenatis tristique",94264880,"sit amet consectetuer adipiscing"
YU567670,VHU-WAT,vel,57670433,"lectus in est risus"
YV363358,GJQ-YCD,nisi,76999260,"neque aenean auctor gravida sem praesent id massa"
YV593764,KNS-IAN,"congue risus",39131477,"nulla dapibus dolor vel"
YV915244,ZZA-UFZ,"lacinia nisi",76652491,"nunc vestibulum ante ipsum primis in faucibus"
YX138103,DBP-ZXR,orci,73346070,"in felis eu"
YX580067,VQZ-SIU,habitasse,76763333,"nulla sed accumsan felis ut at"
YY300243,CLL-WJH,"ut rhoncus",56673021,"molestie hendrerit"
YZ643310,ZKZ-JVT,vehicula,11617753,"eleifend quam a odio in hac habitasse platea"
YZ934328,EJA-JIB,"nibh quisque",31362674,"justo lacinia eget tincidunt eget tempus vel pede morbi"
ZA605148,PVD-KRA,rhoncus,50986427,"ante ipsum primis in"
ZB726771,XOS-LDG,"suspendisse potenti",22865246,"in eleifend quam a odio in hac habitasse platea"
ZC836623,HWQ-BCC,"molestie sed",88575090,"non mauris morbi"
ZC838769,CEI-JJH,lobortis,52713206,"platea dictumst aliquam augue quam sollicitudin vitae consectetuer eget"
ZD621109,MYR-NOU,non,51352267,"ultrices vel augue vestibulum"
ZE245921,RFP-BOK,nulla,69971656,"dui vel sem sed sagittis nam congue risus semper porta"
ZE370870,QLM-FKX,lacinia,44970849,"eros vestibulum ac est lacinia nisi venenatis tristique"
ZE944033,TBS-EDO,in,10811162,"sapien a libero nam dui proin leo odio porttitor"
ZG785839,XFS-RFT,donec,18703900,"vel nisl duis ac nibh fusce lacus"
ZH555639,CJU-KTV,"lorem id",81635464,"vehicula consequat morbi a ipsum integer a nibh in quis"
ZK633004,ECD-PVX,venenatis,59993354,"vel ipsum praesent blandit lacinia"
ZM173967,BSY-NPP,"tempor convallis",14203126,"et magnis dis parturient montes nascetur ridiculus"
ZM852575,LJW-VRG,dui,68782750,"nonummy integer non velit donec diam neque"
ZN119776,DIU-MAK,"porttitor id",23681415,"magnis dis parturient montes nascetur ridiculus mus"
ZQ878181,TDK-QBX,adipiscing,84740862,"justo maecenas rhoncus aliquam lacus morbi quis"
ZQ943988,NFC-XAR,"platea dictumst",30851935,"amet sapien dignissim vestibulum vestibulum ante ipsum primis"
ZS860612,ZGH-UJX,suspendisse,78893496,"magnis dis parturient montes nascetur ridiculus mus etiam"
ZS954115,WFP-CKX,sit,49727752,"felis eu sapien cursus"
ZT650570,RTS-YGC,in,18184119,"nulla suscipit ligula in lacus curabitur"
ZT687102,HTX-KCA,commodo,53301004,"vestibulum ac est lacinia nisi venenatis"
ZT812422,AON-BYU,"pellentesque eget",32709242,"hendrerit at"
ZT909200,SNO-DMT,interdum,90455328,"ultrices libero non mattis pulvinar nulla pede ullamcorper augue a"
ZW013405,WPQ-XHB,imperdiet,65600315,"vel lectus in quam fringilla rhoncus mauris"
ZW193532,NDF-UBT,"a suscipit",89976998,"molestie sed justo"
ZW319094,YWT-BBC,"vel accumsan",37069261,"eros viverra eget congue eget semper rutrum nulla nunc purus"
ZW360770,CIO-UFW,"egestas metus",32227099,"viverra dapibus nulla suscipit ligula in lacus curabitur"
ZZ020976,BXJ-BQB,"quam sapien",49900648,"ligula pellentesque ultrices phasellus id sapien in sapien"
ZZ735504,VTY-NKI,suscipit,9157286,"vel augue vestibulum ante ipsum primis"
